{
    "id": "song-1750151193740-zftm4q5ik",
    "title": "Whiskey and Wildfire",
    "artist": "Alex Wilson",
    "singer": "Female Singer",
    "created": "2025-06-17",
    "updated": "2025-06-17",
    "lyrics": "[Verse]\nWhen I think about you, babe\nI think about bad decisions\nI think about midnight mistakes\nAnd good intentions\n\n[Verse 2]\nWell, it was somethin' about the way\nYou loved me like you did\nLike whiskey and wildfire\nBaby, we burned quick\n\n[Chorus]\nMm-mm, yeah, yeah\nYeah, yeah\nOh, whiskey and wildfire\nOh, whiskey and wildfire\n[Verse 3]\nWell, I think about us, babe\nAnd the wild nights in the past\nI still feel that flame\nBut we burned out fast\n\n[Verse 4]\nWell, it's somethin' about the way\nYou loved me like you did\nLike whiskey and wildfire\nBaby, we burned quick\n\n[Chorus]\nMm-mm, yeah, yeah\nYeah, yeah\nOh, whiskey and wildfire\nOh, whiskey and wildfire\n\n[Verse 5]\nWell, it's somethin' about the way\nYou loved me like you did\nLike whiskey and wildfire\nBaby, we burned quick",
    "soundsLike": "outlaw country, raw, female vocals, big hook, country",
    "imageUrl": "https://fal.media/files/kangaroo/EHP2RiVbmY4XDQoTLz4av_cd06149d2c0e443fb936bcf8b3c47c88.jpg",
    "rawContent": "## Whiskey and Wildfire\n**Created:** 2025-06-17\n**Updated:** 2025-06-17\n**Songwriter:** Alex Wilson\n**Singer:** Female Singer\n\n### Lyrics\n[Verse]\nWhen I think about you, babe\nI think about bad decisions\nI think about midnight mistakes\nAnd good intentions\n\n[Verse 2]\nWell, it was somethin' about the way\nYou loved me like you did\nLike whiskey and wildfire\nBaby, we burned quick\n\n[Chorus]\nMm-mm, yeah, yeah\nYeah, yeah\nOh, whiskey and wildfire\nOh, whiskey and wildfire\n[Verse 3]\nWell, I think about us, babe\nAnd the wild nights in the past\nI still feel that flame\nBut we burned out fast\n\n[Verse 4]\nWell, it's somethin' about the way\nYou loved me like you did\nLike whiskey and wildfire\nBaby, we burned quick\n\n[Chorus]\nMm-mm, yeah, yeah\nYeah, yeah\nOh, whiskey and wildfire\nOh, whiskey and wildfire\n\n[Verse 5]\nWell, it's somethin' about the way\nYou loved me like you did\nLike whiskey and wildfire\nBaby, we burned quick\n\n### Sounds Like\noutlaw country, raw, female vocals, big hook, country\n\n"
}